{
  "contractVersion": 1,
  "key": "admin",
  "title": "Administration",
  "description": "RBAC, user governance, and privileged role-management behavior.",
  "requires": {
    "core": ">=0.3"
  },
  "capabilities": {
    "provides": [
      {
        "name": "admin.users.read",
        "since": "0.3.3"
      },
      {
        "name": "admin.users.admin",
        "since": "0.3.3"
      },
      {
        "name": "admin.invitations.admin",
        "since": "0.5.0"
      }
    ],
    "consumes": []
  },
  "capabilityExports": {
    "admin.users.read": {
      "specifier": "./users",
      "symbol": "listAdminUsers"
    },
    "admin.users.admin": {
      "specifier": ".",
      "symbol": "applyAdminRoleChanges"
    },
    "admin.invitations.admin": {
      "specifier": ".",
      "symbol": "createAdminUserInvitation"
    }
  },
  "events": {
    "emits": [],
    "consumes": []
  },
  "permissions": {
    "surfaces": "admin",
    "grants": [
      {
        "name": "admin.manage",
        "defaultRoles": ["admin"]
      }
    ]
  },
  "registration": "./registration",
  "database": {
    "namespace": ["role", "admin_user_"],
    "ownedObjects": [
      "roles",
      "user_role_assignments",
      "role_change_audit",
      "current_global_role",
      "has_role",
      "is_staff",
      "is_admin",
      "admin_set_user_role",
      "guard_privileged_profile_fields",
      "ensure_profile_role_assignment",
      "trg_ensure_profile_role_assignment",
      "admin_user_invitations",
      "touch_admin_user_invitations_updated_at",
      "trg_touch_admin_user_invitations_updated_at",
      "normalize_admin_user_invitation_email",
      "trg_normalize_admin_user_invitation_email",
      "accept_admin_user_invitation"
    ]
  }
}
