{
  "contractVersion": 1,
  "key": "projects",
  "title": "Projects",
  "description": "Projects, tasks, milestones, members, links, and project activity policies.",
  "requires": {
    "core": ">=0.3",
    "admin": ">=0.3",
    "orgs": ">=0.1"
  },
  "capabilities": {
    "provides": [
      {
        "name": "projects.projects.read",
        "since": "0.4.1"
      },
      {
        "name": "projects.projects.write",
        "since": "0.4.1"
      }
    ],
    "consumes": []
  },
  "capabilityExports": {
    "projects.projects.read": {
      "specifier": "./server",
      "symbol": "listProjects"
    },
    "projects.projects.write": {
      "specifier": "./server",
      "symbol": "createProject"
    }
  },
  "events": {
    "emits": [],
    "consumes": []
  },
  "permissions": {
    "surfaces": "staff",
    "grants": [
      {
        "name": "projects.manage",
        "defaultRoles": [
          "staff",
          "admin"
        ]
      },
      {
        "name": "projects.create_tasks",
        "description": "Current administrators and current staff project owners/contributors may create tasks.",
        "defaultRoles": [
          "staff",
          "admin"
        ]
      },
      {
        "name": "projects.share_client_tasks",
        "description": "Current administrators and current staff project owners/contributors may publish authored client tasks within existing project eligibility.",
        "defaultRoles": [
          "staff",
          "admin"
        ]
      },
      {
        "name": "projects.review_client_tasks",
        "description": "Current administrators and current staff project owners/contributors may review the exact current submitted version.",
        "defaultRoles": [
          "staff",
          "admin"
        ]
      }
    ]
  },
  "registration": "./registration",
  "database": {
    "namespace": [
      "project"
    ],
    "ownedObjects": [
      "projects",
      "project_members",
      "project_milestones",
      "project_tasks",
      "project_task_stats",
      "project_links",
      "project_status_log",
      "project_organizations",
      "project_client_organizations",
      "project_client_profiles",
      "project_creation_requests",
      "is_project_org_admin",
      "is_project_org_member",
      "can_create_projects_for_org",
      "is_project_team_member",
      "is_project_content_editor",
      "is_project_owner_member",
      "can_current_client_view_project",
      "set_project_organizations",
      "set_project_client_access",
      "set_project_client_configuration",
      "get_project_access_configuration",
      "get_project_client_access_summary",
      "create_project_with_client_access",
      "list_current_client_projects",
      "get_current_client_project",
      "sync_project_members_exact",
      "protect_project_identity_fields",
      "clear_stale_project_client_profile_grants",
      "prevent_internal_project_role_downgrade",
      "trg_prevent_internal_project_role_downgrade",
      "trg_protect_project_identity_fields",
      "trg_clear_stale_project_client_profile_grants",
      "set_project_updated_at",
      "trg_projects_updated_at",
      "trg_project_milestones_updated_at",
      "trg_project_tasks_updated_at",
      "trg_project_links_updated_at",
      "sync_project_lifecycle_dates",
      "trg_projects_lifecycle_dates",
      "sync_project_primary_organization",
      "trg_sync_project_primary_organization",
      "enforce_internal_project_identity",
      "trg_enforce_internal_project_owner",
      "trg_enforce_internal_project_member",
      "validate_project_owner_consistency",
      "trg_validate_project_owner_from_project",
      "trg_validate_project_owner_from_member",
      "validate_project_primary_participation",
      "trg_validate_project_primary_participation",
      "enforce_project_client_content_manager",
      "trg_enforce_project_client_content_manager",
      "enforce_client_visible_project_item_manager",
      "trg_enforce_client_milestone_manager",
      "trg_enforce_client_link_manager",
      "project_activity_project_name",
      "log_project_activity_event",
      "log_projects_activity_event",
      "trg_log_projects_activity_event",
      "log_project_tasks_activity_event",
      "trg_log_project_tasks_activity_event",
      "log_project_milestones_activity_event",
      "trg_log_project_milestones_activity_event",
      "log_project_links_activity_event",
      "trg_log_project_links_activity_event",
      "log_project_members_activity_event",
      "trg_log_project_members_activity_event",
      "aa_project_client_task_write",
      "ab_delete_project_client_tasks",
      "ab_unlink_profile_client_tasks",
      "ab_withdraw_milestone_client_tasks",
      "act_on_current_client_project_task",
      "bw_projects_private",
      "bw_projects_private.client_eligible",
      "bw_projects_private.delete_project_tasks",
      "bw_projects_private.guard_task_write",
      "bw_projects_private.lock_actor",
      "bw_projects_private.lock_client",
      "bw_projects_private.lock_task_milestone",
      "bw_projects_private.requests",
      "bw_projects_private.revoke_bindings",
      "bw_projects_private.submissions",
      "bw_projects_private.task_bindings",
      "bw_projects_private.task_json",
      "bw_projects_private.task_visible",
      "bw_projects_private.unlink_profile_tasks",
      "bw_projects_private.valid_task_assignee",
      "bw_projects_private.validate_configuration",
      "bw_projects_private.withdraw_milestone_tasks",
      "bw_projects_private.write_bindings",
      "bw_projects_task_executor",
      "can_current_user_create_project_tasks",
      "enforce_project_task_assignee_and_contributor_update",
      "get_project_client_task_workbench",
      "list_current_client_project_tasks",
      "manage_project_client_task",
      "trg_client_task_membership_revocation",
      "trg_client_task_participation_revocation",
      "trg_client_task_profile_revocation",
      "trg_client_task_project_audience_revocation",
      "trg_client_task_project_mode_revocation",
      "trg_client_task_project_profile_revocation",
      "trg_client_task_role_revocation"
    ]
  }
}
